Category Code,Category Label
19801011,"Milkshake, chocolate or coffee flavour, regular fat cows milk, with ice cream"
19801012,"Milkshake, chocolate or coffee flavour, regular fat cows milk, without ice cream"
19801013,"Thickshake, chocolate or coffee flavour, regular fat cows milk, with ice cream"
19801014,"Thickshake, all flavours, with cows milk, crushed ice, ice cream & confectionary, fast food style"
19802,"Milk, other flavoured and milk-based drinks, full fat"
19802001,"Milk, cow, fluid, flavoured, strawberry, regular fat"
19802002,"Milk, cow, fluid, flavoured, all other flavours, regular fat"
19802003,"Milkshake, non-chocolate or coffee flavours, regular fat cows milk, with ice cream"
19802004,"Milkshake, non-chocolate or coffee flavours, regular fat cows milk, without ice cream"
19802005,"Thickshake, non-chocolate or coffee flavour, regular fat cows milk, with ice cream"
19803,"Milk, coffee/chocolate flavoured and milk-based drinks, reduced fat"
19803001,"Iced coffee, reduced fat cows milk"
19803002,"Iced coffee, reduced fat cows milk, with ice cream"
19803003,"Milk, cow, fluid, flavoured, chocolate, reduced fat"
19803004,"Milk, cow, fluid, flavoured, chocolate, reduced fat, added Ca & vitamin D"
19803005,"Milk, cow, fluid, flavoured, chocolate, reduced fat, added vitamins & minerals"
19803006,"Milk, cow, fluid, flavoured, coffee, reduced fat"
19803007,"Milkshake, chocolate or coffee flavour, reduced fat cows milk, with ice cream"
19803008,"Milkshake, chocolate or coffee flavour, reduced fat cows milk, without ice cream"
19804,"Milk, other flavoured and milk-based drinks, reduced fat"
19804001,"Milk, cow, fluid, flavoured, strawberry, reduced fat"
19804002,"Milk, cow, fluid, flavoured, all other flavours, reduced fat"
19804003,"Milkshake, non-chocolate or coffee flavours, reduced fat cows milk, with ice cream"
19804004,"Milkshake, non-chocolate or coffee flavours, reduced fat cows milk, without ice cream"
19804005,"Thickshake, caramel flavour, fast food style"
19804006,"Thickshake, chocolate flavour, fast food style"
19804007,"Thickshake, strawberry flavour, fast food style"
19804008,"Thickshake, vanilla flavour, fast food style"
19805,"Milk, other flavoured and milk-based drinks, not stated as to fat"
19805001,"Drink, cows milk, added egg & sugar (eggnog or egg nog)"
19806,Milk-based fruit drinks
19806001,"Smoothie, cows milk, all flavours, added banana"
19806002,"Smoothie, cows milk, all flavours, added berries"
19806003,"Smoothie, cows milk, all flavours, added mango"
19806004,"Smoothie, cows milk, all flavours, added mixed fruit"
19806005,"Smoothie, cows milk, all flavours, added mixed fruit & egg"
19806006,"Smoothie, cows milk, all flavours, added mixed fruit, guarana & herbal extracts"
19806007,"Smoothie, cows milk, all flavours, added mixed fruit & nuts or seeds"
20,Dairy & meat substitutes
201,"Dairy milk substitutes, unflavoured"
20101,"Soy-based beverage, plain"
20101001,"Beverage base, soy, dry powder (not infant food)"
20101002,"Soy beverage, regular fat (~3%), unfortified"
20101003,"Soy beverage, regular fat (~3%), homemade from basic ingredients, unfortified"
20102,"Soy-based beverage, plain, fortified"
20102001,"Soy beverage, regular fat (~3%), added Ca"
20102002,"Soy beverage, regular fat (~3%), added Ca & vitamins A, B2, & B12"
20102003,"Soy beverage, regular fat (~3%), added Ca & vitamins A, B1, B2 & B12"
20102004,"Soy beverage, regular fat (~3%), added Ca & vitamins A, B1, B2, B6, B12, & D"
20103,"Soy-based beverage, plain, reduced fat"
20103001,"Soy beverage, reduced fat (~1% fat), unfortified"
20104,"Soy-based beverage, plain, reduced fat, fortified"
20104001,"Soy beverage, reduced fat (~1.5% fat), added Ca"
20104002,"Soy beverage, reduced fat (~1.5% fat), added vitamins A, B1, B2, B3, B6, B12, C, E, folate & Ca & Fe"
20104003,"Soy beverage, reduced fat (~1.5% fat), added fibre, Ca & vitamins A, B1, B2, B6 & B12"
20104004,"Soy beverage, reduced fat (~1% fat), added Ca & vitamins A, B2 & B12"
20104005,"Soy beverage, reduced fat (~1% fat), added Ca & vitamins A, B1, B2 & B12"
20105,"Soy-based beverage, plain, skim, fortified"
20105001,"Soy beverage, low fat (~ 0.1%), added Ca & vitamins A, B1, B2 & B12"
20106,Cereal- or nut-based milk substitute
20106001,"Milk, almond, fluid"
20106002,"Milk, oat, fluid, unfortified"
20106003,"Milk, oat, fluid, added calcium"
20106004,"Milk, rice, fluid, added calcium"
20106005,"Milk, rice, fluid, protein enriched, added calcium"
20107,"Dairy milk substitute, unspecified"
20107001,"Babyccino, from soy milk"
20107002,"Smoothie, non-dairy base, all flavours, added mixed fruit"
20107003,"Soy beverage, regular fat (~3%), unflavoured, not further defined"
20107004,"Soy beverage, reduced fat (1-2%), unflavoured, not further defined"
20107005,"Soy beverage, unflavoured, not further defined"
202,"Dairy milk substitutes, flavoured"
20201,"Soy-based beverage, regular fat, flavoured"
20201001,"Iced coffee, regular fat soy milk"
20201002,"Milkshake, non-chocolate or coffee flavours, soy milk, without ice cream"
20201003,"Soy beverage, chocolate flavoured, regular fat (~3%), added Ca & vitamins A, B1, B2 & B12"
20202,"Soy-based beverage, reduced fat, flavoured"
20202001,"Soy beverage, chocolate flavoured, reduced fat (~ 1.5%), added Ca & vitamins A, B1, B2 & B12"
20202002,"Soy beverage, coffee flavoured, reduced fat (~ 1.5%), added Ca & vitamins A, B1, B2 & B12"
203,Cheese substitute
20301,Cheese substitute
20301001,"Cheese, soy"
204,Soy-based ice confection
20401,Soy-based ice confection
20401001,"Ice confection, non-dairy, chocolate or coffee flavour, regular fat"
20401002,"Ice confection, non-dairy, vanilla flavour, regular fat"
205,Soy-based yoghurts
20501,"Soy-based yoghurts, regular fat"
20501001,"Yoghurt, soy based, berry flavoured, regular fat (approx. 3%)"
20502,"Soy-based yoghurts, reduced fat"
20502001,"Yoghurt, soy based, apricot or mango flavoured, reduced fat (approx. 1%)"
20502002,"Yoghurt, soy based, berry flavoured, reduced fat (1%)"
20502003,"Yoghurt, soy based, vanilla flavoured, reduced fat (approx. 1%)"
206,Meat substitutes
20601,Meat substitutes
20601001,"Meat alternative, commercial, cooked, no added fat"
20601002,"Meat alternative, commercial, cooked, fat not further defined"
20601003,"Sausage, vegetarian style, raw"
20601004,"Sausage, vegetarian style, added Fe, Zn and vitamin B12, raw"
20601005,"Soy bean curd skins, dried, rehydrated in boiling water"
20601006,"Tempeh (fermented soy beans), fried"
20601007,"Tofu (soy bean curd), firm, as purchased"
20601008,"Tofu (soy bean curd), silken or soft, as purchased"
20601009,"Tofu (soy bean curd), smoked, as purchased"
20601010,"Tofu (soy bean curd), fried, stir-fried, grilled or BBQ'd, no added fat"
20601011,"Tofu (soy bean curd), fried, stir-fried, grilled or BBQ'd, fat not further defined"
20601012,"Tofu (soy bean curd), burger patty, as purchased"
20601013,"Vegetarian meat, bacon, cooked, with or without added fat"
207,Dishes where meat substitutes are the major component
20701,Dishes where meat substitutes are the major component
20701001,"Curry, commercial, tofu & vegetable"
20701002,"Hamburger, no roll, vegetable & lentil patty, with salad, takeaway & homemade"
20701003,"Stir-fry, homemade, tofu, commercial or homemade satay sauce"
20701004,"Stir-fry, homemade, tofu & vegetable"
21,Soup
211,"Soup, homemade from basic ingredients"
21101,"Soup containing meat, poultry or seafood"
21101001,"Soup, beef & vegetable, prepared with stock or water, homemade from basic ingredients"
21101002,"Soup, beef & vegetable, with pasta or grains, prepared with stock or water, homemade from basic ingredients"
21101003,"Soup, beef, vegetable & legume, prepared with stock or water, homemade from basic ingredients"
21101004,"Soup, beef, vegetable & legume, with pasta or grains, prepared with stock or water, homemade"
21101005,"Soup, broth with meat & noodles"
21101006,"Soup, chicken & sweetcorn, prepared with stock or water, homemade from basic ingredients"
21101007,"Soup, chicken & vegetable, prepared with stock or water, homemade from basic ingredients"
21101008,"Soup, chicken & vegetable, with grains or pasta, prepared with stock or water, homemade from basic ingredients"
21101009,"Soup, chicken, vegetable & legume, prepared with stock or water, homemade from basic ingredients"
21101010,"Soup, chicken, vegetable & legume, with grains or pasta, prepared with stock or water, homemade"
21101011,"Soup, fish, prepared with stock or water, homemade from basic ingredients"
21101012,"Soup, ham & vegetable, prepared with stock or water, homemade from basic ingredients"
21101013,"Soup, ham & vegetable, with pasta or grains, prepared with stock or water, homemade from basic ingredients"
21101014,"Soup, lamb & vegetable, prepared with stock or water, homemade from basic ingredients"
21101015,"Soup, lamb & vegetable, with grains or pasta, prepared with stock or water, homemade from basic ingredients"
21101016,"Soup, lamb, vegetable & legume, prepared with stock or water, homemade from basic ingredients"
21101017,"Soup, offal, prepared with stock or water, homemade from basic ingredients"
21101018,"Soup, mussel, oyster or scallop, homemade from basic ingredients"
21101019,"Soup, pea & ham, prepared with stock or water, homemade from basic ingredients"
21101020,"Soup, pork & vegetable, prepared with stock or water, homemade from basic ingredients"
21101021,"Soup, pork & vegetable, with grains or pasta, prepared with stock or water, homemade from basic ingredients"
21101022,"Soup, pork, vegetable & legume, prepared with stock or water, homemade from basic ingredients"
21101023,"Soup, seaweed, with or without meat, vegetables & grains or pasta"
21101024,"Soup, shark's fin"
21101025,"Soup, wonton, clear broth with dumplings"
21102,"Soup, vegetable only"
21102001,"Soup, broth, Asian style, with egg & rice"
21102002,"Soup, cream of vegetable, prepared with cream or milk, homemade from basic ingredients"
21102003,"Soup, French onion, homemade from basic ingredients"
21102004,"Soup, minestrone, prepared, from cafe or restaurant"
21102005,"Soup, minestrone, prepared with stock or water, homemade from basic ingredients"
21102006,"Soup, miso, with tofu & seaweed"
21102007,"Soup, mixed vegetable, prepared with stock or water, homemade from basic ingredients"
21102008,"Soup, mixed vegetable & legume, with pasta or grains, prepared with stock or water, homemade from basic ingredients"
21102009,"Soup, mixed vegetable & pasta or grains, prepared with stock or water, homemade from basic ingredients"
21102010,"Soup, mixed vegetable & legume, prepared with stock or water, homemade from basic ingredients"
21102011,"Soup, potato, prepared with stock or water, homemade from basic ingredients"
21102012,"Soup, potato, prepared with stock or water & cream, homemade from basic ingredients"
21102013,"Soup, pumpkin, prepared, from cafe or restaurant"
21102014,"Soup, pumpkin, prepared with stock or water, homemade from basic ingredients"
21102015,"Soup, pumpkin, prepared with stock or water & coconut milk, homemade from basic ingredients"
21102016,"Soup, pumpkin, prepared with stock or water & milk, homemade from basic ingredients"
21102017,"Soup, tomato, prepared with stock or water, homemade from basic ingredients"
212,Dry soup mix
21201,"Dry soup mix containing meat, poultry or seafood"
21201001,"Soup, Asian style meat & vegetable, with noodles, cup of soup, instant dry mix"
21201002,"Soup, Asian style seafood & vegetable, with noodles, cup of soup, instant dry mix"
21201003,"Soup, broth style with meat, cup of soup, instant dry mix"
21201004,"Soup, chicken & noodle, cup of soup, instant dry mix"
21201005,"Soup, chicken, with or without vegetables, cup of soup, instant dry mix"
21201006,"Soup, chicken, with or without vegetables, cup of soup, instant dry mix, reduced salt"
21201007,"Soup, chicken & vegetable, with pasta or croutons, cup of soup, instant dry mix"
21201008,"Soup, pea & ham, cup of soup, instant dry mix"
21202,"Dry soup mix, vegetable only"
21202001,"Soup, cream variety, instant dry mix"
21202002,"Soup, French onion, instant dry mix"
21202003,"Soup, French onion, instant dry mix, reduced salt"
21202004,"Soup, mixed vegetables, reduced energy, cup of soup, instant dry mix"
21202005,"Soup, tomato, with or without noodles, cup of soup, instant dry mix"
21202006,"Soup, vegetable, cup of soup, instant dry mix"
213,"Soup, prepared from dry soup mix"
21301,"Soup containing meat, poultry or seafood"
21301001,"Soup, Asian style seafood & vegetable, with noodles, cup of soup, prepared from instant dry mix with water"
21301002,"Soup, broth style with meat, prepared from instant dry mix with water"
21301003,"Soup, chicken & noodle, cup of soup, prepared from instant dry mix with water"
21301004,"Soup, chicken, with or without vegetables, cup of soup, prepared from instant dry mix with water"
21301005,"Soup, chicken, with or without vegetables, cup of soup, reduced salt, prepared from instant dry mix with water"
21301006,"Soup, pea & ham, cup of soup, prepared from instant dry mix with water"
21302,"Soup, vegetable only"
21302001,"Soup, cream variety, prepared from dry mix with water"
21302002,"Soup, cup of soup style with croutons, prepared from instant dry mix with water"
21302003,"Soup, French onion, prepared from instant dry mix with water"
21302004,"Soup, mixed vegetables, prepared from instant dry mix with water"
21302005,"Soup, tomato, with or without noodles, cup of soup, prepared from instant dry mix with water"
21302006,"Soup, vegetable, cup of soup, prepared from instant dry mix with water"
214,Canned condensed soup (unprepared)
21401,"Soup containing meat, poultry or seafood"
21401001,"Soup, cream of chicken, condensed, canned"
21402,"Soup, vegetable only"
21402001,"Soup, cream of vegetables, condensed, canned"
21402002,"Soup, tomato, condensed, canned"
215,"Soup, commercially sterile, prepared from condensed or sold ready to eat"
21501,"Soup containing meat, poultry or seafood"
21501001,"Soup, chicken & noodle, ready to eat, canned"
21501002,"Soup, chicken & sweetcorn, ready to eat, canned"
21501003,"Soup, chicken & vegetable, ready to eat, canned"
21501004,"Soup, cream of chicken, condensed, canned, prepared with regular fat cows milk & water"
21501005,"Soup, cream of seafood, condensed, canned, prepared with regular fat cows milk & water"
21501006,"Soup, meat & vegetable, canned, ready-to-eat, heated"
21501007,"Soup, pea & ham, condensed, canned, prepared with water"
21501008,"Soup, pea & ham, ready to eat, canned"
21502,"Soup, vegetable only"
21502001,"Soup, cream of vegetables, condensed, canned, prepared with regular fat cows milk & water"
21502002,"Soup, cream of vegetable, ready to eat, canned"
21502003,"Soup, pumpkin, ready to eat, canned"
21502004,"Soup, tomato, condensed, canned, prepared with water"
21502005,"Soup, tomato, condensed, canned, prepared with cows milk & water"
21502006,"Soup, tomato, ready to eat, canned"
21502007,"Soup, vegetable, ready to eat, canned"
216,"Soup, not commercially sterile, purchased ready to eat"
21601,"Soup containing meat, poultry or seafood"
21601001,"Soup, beef & vegetable, from cafe or restaurant"
21601002,"Soup, chicken & vegetable, from cafe or restaurant"
21601003,"Soup, hot & sour (tom yum), prepared with stock or water"
21601004,"Soup, laksa, beef, chicken or pork, with noodles, prepared with coconut milk"
21601005,"Soup, laksa, prawn or seafood, with noodles, prepared with coconut milk"
21602,"Soup, vegetable only"
21602001,"Soup, lentil or other legumes, from cafe or restaurant"
21602002,"Soup, mixed vegetable, from cafe or restaurant"
22,Seed and nut products and dishes
221,Seeds and seed products
22101,Seeds
22101001,"Seed, chia, dried"
22101002,"Seed, chia, cooked, no added salt"
22101003,"Seed, linseed or flaxseed"
22101004,"Seeds, mixed"
22101005,"Seed, poppy"
22101006,"Seed, pumpkin, hulled & dried, unsalted"
22101007,"Seed, sesame, unsalted"
22101008,"Seed, sunflower, unsalted"
22101009,"Wattle seed (acacia), ground"
22102,Seed products
22102001,"Psyllium, dry, uncooked"
22102002,"Psyllium, cooked in water, no added salt"
22102003,"Psyllium, cooked in soy milk, no added salt"
22102004,"Tahini, sesame seed pulp"
222,Nuts and nut products
22201,Peanuts
22201001,"Nut, peanut, with skin, raw or dry roasted, unsalted"
22201002,"Nut, peanut, with skin, roasted, with oil, salted"
22201003,"Nut, peanut, without skin, roasted, with oil, salted"
22201004,"Nut, peanut, without skin, roasted, with oil, unsalted"
22202,Peanut products
22202001,"Nut, peanut, roasted, coated in honey"
22202002,"Peanut butter, smooth & crunchy, added sugar & salt"
22202003,"Peanut butter, smooth & crunchy, added sugar, no added salt"
22202004,"Peanut butter, smooth & crunchy, no added sugar or salt"
22202005,"Peanut butter, not further identified"
22202006,"Sauce, satay, commercial"
22202007,"Sauce, satay, homemade"
22203,Coconut and coconut products
22203001,"Coconut, fresh, mature fruit, flesh"
22203002,"Coconut, fresh, young or immature, flesh"
22203003,"Coconut, fresh, mature, water or juice"
22203004,"Coconut, fresh, young or immature, water or juice"
22203005,"Coconut, grated & desiccated"
22203006,"Coconut, cream, regular fat"
22203007,"Coconut, milk, dried, powder"
22203008,"Coconut, milk, canned, regular fat"
22203009,"Coconut, milk, canned, reduced fat"
22203010,"Coconut, milk, canned, not further defined"
22204,Other nuts and nut products and dishes
22204001,"Chestnut puree, added sugar"
22204002,"Nut, almond meal"
22204003,"Nut, almond, with or without skin, roasted, salted"
22204004,"Nut, almond, with or without skin, raw, unsalted"
22204005,"Nut, almond, with or without skin, roasted, unsalted"
22204006,"Nut, almond, without skin, blanched, unsalted"
22204007,"Nut, brazil, with or without skin, raw, unsalted"
22204008,"Nut, cashew, raw, unsalted"
22204009,"Nut, cashew, roasted, salted"
22204010,"Nut, cashew, roasted, unsalted"
22204011,"Nut, cashew, roasted, coated in honey"
22204012,"Nut, chestnut, raw, unsalted"
22204013,"Nut, chestnut, roasted, unsalted"
22204014,"Nut, hazelnut, with or without skin, raw, unsalted"
22204015,"Nut, macadamia, raw, unsalted"
22204016,"Nut, macadamia, roasted, salted"
22204017,"Nut, macadamia, roasted, coated in honey"
22204018,"Nut, pecan, raw, unsalted"
22204019,"Nut, pine, raw, unsalted"
22204020,"Nut, pistachio, roasted, salted"
22204021,"Nut, pistachio, raw, unsalted"
22204022,"Nut, walnut, raw, unsalted"
22204023,Pandanus kernel
22205,Mixed nuts or nuts and seeds
22205001,"Mixed nuts, almond, cashew, peanut, salted"
22205002,"Mixed nuts, almond, cashew, peanut, unsalted"
22205003,"Mixed nuts, almond, cashew, walnut, unsalted"
22205004,"Mixed nuts, cashew & macadamia, salted"
22205005,"Mixed nuts, peanut & 2 or fewer other nuts, salted"
22205006,"Mixed nuts, peanut & 2 or fewer other nuts, unsalted"
22205007,"Mixed nuts, three or fewer, without peanuts, salted"
22205008,"Mixed nuts, three or fewer, without peanuts, unsalted"
22205009,"Mixed nuts, peanut & 3 or more other nuts, salted"
22205010,"Mixed nuts, peanut & 3 or more other nuts, unsalted"
22205011,"Mixed nuts, four or more nuts, without peanuts, salted"
22205012,"Mixed nuts, four or more nuts, without peanuts, unsalted"
22205013,"Mixed nuts, without peanuts, raw, unsalted"
22205014,"Mixed nuts & seeds, with peanut"
22205015,"Mixed nuts & seeds, without peanut"
22205016,"Mixed nuts & seeds, almond, linseed & sunflower seed (LSA), unsalted"
23,Savoury sauces and condiments
231,Gravies and savoury sauces
23101,Gravies (prepared)
23101001,"Gravy, prepared from dry powder with water"
23101002,"Gravy, prepared, commercial"
23101003,"Gravy, prepared from pan-drippings"
23101004,"Gravy, reduced salt, prepared from dry powder with water"
23101005,"Gravy, prepared, reduced salt, commercial"
23101006,"Sauce, mushroom, commercial, ready to eat"
23101007,"Sauce, mushroom, prepared from commercial dry mix"
23102,Dry gravy mixes
23102001,"Gravy powder, dry mix"
23102002,"Gravy powder, dry mix, reduced salt"
23103,"Savoury sauces, not tomato based, commercial"
23103001,"Marinade, Asian style"
23103002,"Marinade, teriyaki, commercial"
23103003,"Mustard, cream style"
23103004,"Sauce, apricot, commercial or homemade"
23103005,"Sauce, barbecue, commercial"
23103006,"Sauce, black bean, commercial"
23103007,"Sauce, chilli (chili), Asian, commercial"
23103008,"Sauce, cranberry, commercial"
23103009,"Sauce, fish, commercial"
23103010,"Sauce, garlic, commercial"
23103011,"Sauce, hoi sin, commercial"
23103012,"Sauce, honey soy, commercial"
23103013,"Sauce, horseradish, commercial"
23103014,"Sauce, HP, commercial, regular"
23103015,"Sauce, mint, commercial or homemade"
23103016,"Sauce, oyster, commercial"
23103017,"Sauce, pad Thai, commercial"
23103018,"Sauce, pasta, basil pesto, commercial"
23103020,"Sauce, pepper, commercial"
23103021,"Sauce, plum, commercial"
23103022,"Sauce, soy, commercial, regular"
23103023,"Sauce, soy, commercial, reduced salt"
23103024,"Sauce, sweet chilli (chili), commercial"
23103025,"Sauce, tabasco, commercial"
23103026,"Sauce, teriyaki, commercial"
23103027,"Sauce, worcestershire, commercial"
23104,"Savoury sauces, tomato based, commercial"
23104001,"Sauce, enchilada, commercial"
23104002,"Sauce, pasta, tomato-based, commercial"
23104003,"Sauce, pasta, tomato pesto, commercial"
23104004,"Sauce, salsa, tomato-based, commercial"
23104005,"Sauce, taco style, commercial"
23104006,"Sauce, tomato, commercial, regular"
23104007,"Sauce, tomato, commercial, reduced salt"
23104008,"Sauce, tomato, commercial, no added salt"
23104009,"Sauce, tomato, not further defined"
23105,"Savoury sauces, not tomato based, homemade"
23105001,"Sauce, basil pesto, homemade"
23105002,"Sauce, bearnaise, homemade"
23105003,"Sauce, garlic, homemade"
23105004,"Sauce, hollandaise, homemade"
23105005,"Sauce, pasta, rocket pesto, homemade"
23105006,"Sauce, wine reduction, homemade"
23106,"Savoury sauces, tomato based, homemade"
23106001,"Sauce, barbecue, homemade"
23106002,"Sauce, pasta, tomato based, homemade"
23106003,"Sauce, salsa, tomato-based, homemade from basic ingredients"
23106004,"Sauce, tomato, homemade"
23107,"Savoury sauces, commercial, simmer style"
23107001,"Sauce, butter chicken, commercial"
23107002,"Sauce, curry, Asian, commercial"
23107003,"Sauce, lemon chicken, commercial"
23107004,"Sauce, pasta or simmer, not further defined, commercial, low fat"
23107005,"Sauce, pasta, carbonara, commercial"
23107006,"Sauce, pasta, cheese or cream-based, commercial"
23107007,"Sauce, simmer for chicken, not further defined, commercial"
23107008,"Sauce, simmer, curry flavoured, commercial"
23107009,"Sauce, stroganoff, commercial"
23107010,"Sauce, sweet & sour, commercial"
23108,"Savoury sauces, dairy based, homemade"
23108001,"Sauce, cheese, homemade with undefined cows milk & fat"
23108002,"Sauce, cream based, homemade from basic ingredients"
23108003,"Sauce, mushroom, homemade"
23108004,"Sauce, mustard, homemade"
23108005,"Sauce, pasta, carbonara, homemade"
23108006,"Sauce, pepper, homemade"
23108007,"Sauce, stroganoff, homemade"
23108008,"Sauce, white, savoury, homemade with an undefined cows milk & fat"
23109,Savoury pastes
23109002,"Paste, curry, Indian style, commercial"
23109003,"Paste, green curry, commercial"
23109004,"Paste, green curry, homemade"
23109005,"Paste, korma, commercial"
23109006,"Paste, massaman curry, commercial"
23109007,"Paste, red curry, commercial or homemade"
23109008,"Paste, vindaloo, commercial"
23109009,"Paste, wasabi, commercial"
23109010,"Paste, curry, commercial, not further defined"
23110,Dry savoury sauces and casserole bases and dry mixes
23110001,"Casserole base, cream style, dry mix"
23110002,"Casserole base, dry mix"
232,"Pickles, chutneys and relishes"
23201,"Fruit-based pickles, chutneys and relishes"
23201001,"Capers, pickled, canned, drained"
23201002,"Chutney or relish, commercial"
23201003,"Chutney or relish, homemade"
23202,"Vegetable-based pickles, chutneys and relishes"
23202001,"Gherkin, pickled, drained, commercial"
23202002,"Ginger, pickled, drained"
23202003,"Mixed vegetables, pickled, drained"
23202004,"Olive, green or black, drained"
23202005,"Olive, green, pimento stuffed, drained"
23202006,"Onion, pickled, drained, commercial"
23202007,"Pickles, mustard, sweet, commercial"
23202008,"Pickles, for use on sandwiches, not further defined"
23202009,"Relish, corn, commercial"
23202010,"Relish, onion, commercial"
233,Salad dressings
23301,"Mayonnaise and cream-style dressings, full fat"
23301001,"Dressing, Caesar, commercial"
23301002,"Dressing, Caesar, homemade"
23301003,"Dressing, coleslaw, commercial, regular fat"
23301004,"Dressing, ranch, commercial"
23301005,"Dressing, thousand island, commercial, regular fat"
23301006,"Mayonnaise, commercial, regular fat"
23301007,"Mayonnaise, commercial, not further defined"
23301008,"Mayonnaise, homemade"
23301009,"Mayonnaise, soybean oil, homemade"
23301010,"Sauce, cocktail or seafood, commercial or homemade"
23301011,"Sauce, tartare (tartar), commercial, regular fat"
23301012,"Sauce, tartare (tartar), homemade"
23302,"Mayonnaise and cream-style dressings, reduced or non-fat"
23302001,"Dressing, coleslaw, commercial, reduced fat"
23302002,"Dressing, creamy, commercial, 97% fat free"
23302003,"Dressing, thousand island, commercial, reduced fat"
23302004,"Mayonnaise, commercial, reduced fat"
23302005,"Mayonnaise, commercial, low fat"
23302006,"Mayonnaise, commercial, 97% fat free"
23303,"Italian and French-style dressings, full fat"
23303001,"Dressing, honey mustard, homemade"
23303002,"Dressing, lemon vinaigrette, homemade"
23303003,"Dressing, mustard, homemade"
23303004,"Dressing, oil & vinegar, commercial, regular fat"
23303005,"Dressing, oil, vinegar & vegetables/herbs, commercial, regular fat"
23303006,"Dressing, sesame soy, homemade"
23303007,"Dressing, vinaigrette, homemade"
